{
  "$schema": "https://json-schema.org/draft/2020-12/schema",
  "$id": "https://quirkbench.invalid/schemas/retarget-local-source.v2.schema.json",
  "type": "object",
  "additionalProperties": false,
  "required": [
    "schema_version",
    "record_type",
    "intent_sha256",
    "old_credential_generation",
    "files",
    "endpoint_selection_sha256"
  ],
  "properties": {
    "schema_version": {
      "type": "integer",
      "const": 2
    },
    "record_type": {
      "const": "retarget-local-source"
    },
    "intent_sha256": {
      "type": "string",
      "pattern": "^[0-9a-f]{64}$"
    },
    "old_credential_generation": {
      "type": "string",
      "pattern": "^[A-Za-z0-9][A-Za-z0-9_.-]{0,127}$"
    },
    "files": {
      "type": "object",
      "minProperties": 11,
      "maxProperties": 32,
      "propertyNames": {
        "type": "string",
        "maxLength": 256
      },
      "additionalProperties": {
        "type": "string",
        "pattern": "^[0-9a-f]{64}$"
      }
    },
    "endpoint_selection_sha256": {
      "type": "string",
      "pattern": "^[0-9a-f]{64}$"
    }
  }
}
