{
  "schema_version": 2,
  "record_type": "retarget-local-source",
  "intent_sha256": "ffffffffffffffffffffffffffffffffffffffffffffffffffffffffffffffff",
  "old_credential_generation": "original-generation",
  "files": {
    "runtime.json": "cccccccccccccccccccccccccccccccccccccccccccccccccccccccccccccccc",
    "media-instance.json": "cccccccccccccccccccccccccccccccccccccccccccccccccccccccccccccccc",
    "agent/journal.json": "cccccccccccccccccccccccccccccccccccccccccccccccccccccccccccccccc",
    "enrollment/pending/intent.json": "cccccccccccccccccccccccccccccccccccccccccccccccccccccccccccccccc",
    "enrollment/pending/request.json": "cccccccccccccccccccccccccccccccccccccccccccccccccccccccccccccccc",
    "enrollment/pending/key.pem": "cccccccccccccccccccccccccccccccccccccccccccccccccccccccccccccccc",
    "enrollment/pending/result.json": "cccccccccccccccccccccccccccccccccccccccccccccccccccccccccccccccc",
    "generations/dddddddddddddddddddddddddddddddddddddddddddddddddddddddddddddddd/ca.pem": "eeeeeeeeeeeeeeeeeeeeeeeeeeeeeeeeeeeeeeeeeeeeeeeeeeeeeeeeeeeeeeee",
    "generations/dddddddddddddddddddddddddddddddddddddddddddddddddddddddddddddddd/device.token": "eeeeeeeeeeeeeeeeeeeeeeeeeeeeeeeeeeeeeeeeeeeeeeeeeeeeeeeeeeeeeeee",
    "generations/dddddddddddddddddddddddddddddddddddddddddddddddddddddddddddddddd/repository.key": "eeeeeeeeeeeeeeeeeeeeeeeeeeeeeeeeeeeeeeeeeeeeeeeeeeeeeeeeeeeeeeee",
    "generations/dddddddddddddddddddddddddddddddddddddddddddddddddddddddddddddddd/repository.crt": "eeeeeeeeeeeeeeeeeeeeeeeeeeeeeeeeeeeeeeeeeeeeeeeeeeeeeeeeeeeeeeee",
    "generations/dddddddddddddddddddddddddddddddddddddddddddddddddddddddddddddddd/runtime.json": "eeeeeeeeeeeeeeeeeeeeeeeeeeeeeeeeeeeeeeeeeeeeeeeeeeeeeeeeeeeeeeee",
    "generations/dddddddddddddddddddddddddddddddddddddddddddddddddddddddddddddddd/lab.public.asc": "eeeeeeeeeeeeeeeeeeeeeeeeeeeeeeeeeeeeeeeeeeeeeeeeeeeeeeeeeeeeeeee",
    "generations/dddddddddddddddddddddddddddddddddddddddddddddddddddddddddddddddd/generation.json": "eeeeeeeeeeeeeeeeeeeeeeeeeeeeeeeeeeeeeeeeeeeeeeeeeeeeeeeeeeeeeeee"
  },
  "endpoint_selection_sha256": "cccccccccccccccccccccccccccccccccccccccccccccccccccccccccccccccc"
}
